label,expression
jiocinema_download_info,how to download jiocinema
jiocinema_download_info,how to install jiocinema
jiocinema_download_info,how to start jiocinema
jiocinema_download_info,i want to download cinema
jiocinema_download_info,is jiocinema available on play store
jiocinema_download_info,place where i can download jiocinema
jiocinema_download_info,where i will get jiocinema
jiocinema_download_info,where i will get jiocinema for android device
jiocinema_download_info,where i will get jiocinema for ios device
jiocinema_download_info,where i will get jiocinema to download
jiocinema_download_location_query,can downloaded movies kept in some other location
jiocinema_download_location_query,can i change location of all jiocinema downloaded movies
jiocinema_download_location_query,can i move downloaded video on some other location
jiocinema_download_location_query,can i switch movies to other location which i download from jiocinema
jiocinema_download_location_query,can i watch downloaded movies in jiocinema app only
jiocinema_download_location_query,can i watch movies in vlc which i have downloaded from jiocinema
jiocinema_download_location_query,help me if i can locate movies in some other place
jiocinema_download_location_query,i want to keep downloaded movies in some other location
jiocinema_download_location_query,is it necessary to watch downloaded movies in jiocinema app only
jiocinema_download_location_query,jiocinema location query
jiocinema_download_location_query,where can i locate movies in jiocinema
jiocinema_download_movie,am not able to download movies from jiocinema
jiocinema_download_movie,am not able to download movies offline from jiocinema
jiocinema_download_movie,can i download a movie or tv show
jiocinema_download_movie,can i download content on jiocinema
jiocinema_download_movie,can i download movies
jiocinema_download_movie,can i download movies on cinema
jiocinema_download_movie,can i download movies on jiocinema
jiocinema_download_movie,can i save movies offline
jiocinema_download_movie,can you play movies offline
jiocinema_download_movie,get me some movies
jiocinema_download_movie,help me in downloading a movie
jiocinema_download_movie,help me in downloading a tv show
jiocinema_download_movie,help me in downloading jiocinema
jiocinema_download_movie,help me in downloading movies
jiocinema_download_movie,help me with content download in jiocinema
jiocinema_download_movie,how can i download a movie
jiocinema_download_movie,how can i download a tv show from jiocinema
jiocinema_download_movie,how can i download content in jiocinema
jiocinema_download_movie,how to download movies from jiocinema
jiocinema_download_movie,how to save movies from jiocinema in my phone
jiocinema_download_movie,i want to download content in jiocinema
jiocinema_download_movie,i want to download movies
jiocinema_download_movie,i want to save movies offline
jiocinema_download_movie,jiocinema download content
jiocinema_download_movie,process to download offline movies from jiocinema
jiocinema_download_movie,save movie from jiocinema
jiocinema_download_movie,save movies in my mobile
jiocinema_download_movie,show me to download content in jiocinema
jiocinema_download_movie,tell me how can i download content in jiocinema
jiocinema_download_movie,tell me the requirements for download movies from jiocinema
jiocinema_download_movie,way to download offline movies from jiocinema
jiocinema_download_movie,what factors are necessary to download movies from jiocinema
jiocinema_download_movie,what i need to download movies from jiocinema
jiocinema_download_movie,which android version is needed to download movies from jiocinema
jiocinema_features,can i only view movies on jiocinema
jiocinema_features,can i view tv shows on jiocinema
jiocinema_features,can i watch tv shows on jiocinema
jiocinema_features,features of jiocinema
jiocinema_features,good points of jiocinema
jiocinema_features,jiocinema features
jiocinema_features,key features of jiocinema
jiocinema_features,qualities of jiocinema
jiocinema_features,salient features of jiocinema
jiocinema_features,specialty of jiocinema
jiocinema_features,what are the features of jiocinema
jiocinema_features,what are the functions of jiocinema
jiocinema_features,what are the key features of jiocinema
jiocinema_features,what are the qualities of jiocinema
jiocinema_genres,can i watch different kind of movies on jiocinema
jiocinema_genres,can i watch different kind of tv shows on jiocinema
jiocinema_genres,different categories on jiocinema
jiocinema_genres,is jiocinema providing different genres movies
jiocinema_genres,is jiocinema providing different genres tv shows
jiocinema_genres,various genres on jiocinema
jiocinema_genres,what are the different genres offered by jiocinema
jiocinema_genres,what are the different kind of movies offered by jiocinema
jiocinema_genres,what are the different kind of tv shows offered by jiocinema
jiocinema_info,explain jiocinema
jiocinema_info,faq of jiocinema app
jiocinema_info,i don't get jiocinema
jiocinema_info,information about jiocinema
jiocinema_info,jiocinema details
jiocinema_info,jiocinema information
jiocinema_info,jiocinema means what
jiocinema_info,jiocinema what is jiocinema
jiocinema_info,tell me about jiocinema
jiocinema_info,tell me details of jiocinema
jiocinema_info,tell me something about jiocinema
jiocinema_info,use of jiocinema
jiocinema_info,what is jiocinema
jiocinema_language,can i get different language movies in jiocinema
jiocinema_language,can i watch different language movies in jiocinema
jiocinema_language,can i watch different language tv shows in jiocinema
jiocinema_language,can i watch movies in hindi
jiocinema_language,can i watch movies online
jiocinema_language,count of total languages which are there in jiocinema
jiocinema_language,does jiocinema supports episodes of different languages
jiocinema_language,does jiocinema supports movies of different languages
jiocinema_language,does jiocinema supports shows of different languages
jiocinema_language,does jiocinema supports tv shows of different languages
jiocinema_language,does jiocinema supports videos of different languages
jiocinema_language,how can i view content of a specific language offered by jiocinema
jiocinema_language,how much languages are there in jiocinema
jiocinema_language,how to view content of a particular language in cinema
jiocinema_language,how to view content of a particular language in jiocinema
jiocinema_language,in how many languages i can watch movies
jiocinema_language,is there different languages covered in jiocinema
jiocinema_language,tv shows for different language
jiocinema_latest_version,can i get notifications when jiocinema have new version
jiocinema_latest_version,fetch me the latest version of jiocinema app
jiocinema_latest_version,get me the latest version of jiocinema app
jiocinema_latest_version,help me with the latest version of jiocinema app
jiocinema_latest_version,how do i find out if the latest version of the jiocinema app is installed in my device will it update automatically
jiocinema_latest_version,how i will come to know that jiocinema is not on latest version
jiocinema_latest_version,how jiocinema will notify me that i have to update it
jiocinema_latest_version,how to find latest version of jiocinema
jiocinema_latest_version,how to find that i am using latest version of jiocinema or not
jiocinema_latest_version,how will i get new version of jiocinema
jiocinema_latest_version,latest version of the jiocinema app
jiocinema_latest_version,new version of jiocinema app
jiocinema_latest_version,update me with the latest version of jiocinema app
jiocinema_latest_version,update me with the new version of jiocinema app
jiocinema_latest_version,way to find latest version of jiocinema
jiocinema_latest_version,what is the latest version of jiocinema app
jiocinema_latest_version,where can i get the latest version of the jiocinema app
jiocinema_net,data speed required for jiocinema
jiocinema_net,do i need to be connected to the internet to use jiocinema
jiocinema_net,in which data speed i can watch movies without buffering
jiocinema_net,in which internet speed i can watch movies without buffering
jiocinema_net,in which net speed i can watch movies without buffering
jiocinema_net,internet connectivity required for jiocinema
jiocinema_net,internet speed required for jiocinema
jiocinema_net,net speed required for jiocinema
jiocinema_net,perfect data speed for jiocinema
jiocinema_net,perfect data speed to watch movies on jiocinema
jiocinema_net,perfect internet speed for jiocinema
jiocinema_net,perfect internet speed to watch movies on jiocinema
jiocinema_net,which data speed is good to watch movies on jiocinema
jiocinema_net,which internet speed is good to watch movies on jiocinema
jiocinema_net,which net speed is good to watch movies on jiocinema
jiocinema_no_net,i got message like network not available in jiocinema
jiocinema_no_net,i got message like network not available while i was opening jiocinema
jiocinema_no_net,i receive network is not available message when i try to open jiocinema app
jiocinema_no_net,network error in jiocinema
jiocinema_no_net,network not available in jiocinema
jiocinema_no_net,no connection in jiocinema
jiocinema_no_net,no network available in jiocinema
jiocinema_no_net,no network connection available for jiocinema
jiocinema_no_net,no network connection available in jiocinema
jiocinema_no_net,no network in jiocinema
jiocinema_no_net,what to do if i received network is not available message when opening jiocinema
jiocinema_no_net,what to do if i received network is not available message when starting jiocinema
jiocinema_no_net,when i open jiocinema network not available is displayed
jiocinema_past_shows,are past episode available on jiocinema
jiocinema_past_shows,are past tv shows available on jiocinema
jiocinema_past_shows,can i look up a tv show episode by month or year
jiocinema_past_shows,can i see earlier tv shows on jiocinema
jiocinema_past_shows,can i see past tv shows on jiocinema
jiocinema_past_shows,can i see previous tv shows on jiocinema
jiocinema_past_shows,can i see yesterdays tv show on jiocinema
jiocinema_past_shows,can i view earlier tv shows on jiocinema
jiocinema_past_shows,can i view past tv shows on jiocinema
jiocinema_past_shows,how do i check for earlier episodes on jiocinema
jiocinema_past_shows,how do i check for past episodes
jiocinema_past_shows,how do i check for previous episodes on jiocinema
jiocinema_recent_viewed,can i get recently viewed movies
jiocinema_recent_viewed,how to find out recently viewed movies or tv shows
jiocinema_recent_viewed,is it possible to view all recently watched movies
jiocinema_recent_viewed,is there any section in jiocinema which can show me my recently viewed movies
jiocinema_recent_viewed,is there any section where i can view recently watched movies
jiocinema_recent_viewed,recent watched items
jiocinema_recent_viewed,recently viewed items in jiocinema
jiocinema_recent_viewed,recently watched episodes
jiocinema_recent_viewed,recently watched shows
jiocinema_recent_viewed,recently watched video
jiocinema_recent_viewed,what is resume section
jiocinema_recent_viewed,what is resume watching section
jiocinema_recent_viewed,where can i see recently watched episodes
jiocinema_recent_viewed,where can i see recently watched items
jiocinema_recent_viewed,where can i see recently watched shows
jiocinema_recent_viewed,where can i see recently watched videos
jiocinema_recent_viewed,where do i find out recently viewed movies or tv shows
jiocinema_search,can i search movie of my favourite actor
jiocinema_search,easy way to find particular movie
jiocinema_search,how can i view movies and tv shows of my favourite actor or director
jiocinema_search,how do i search for my favourite episode in jiocinema
jiocinema_search,how do i search for my favourite movie
jiocinema_search,how do i search for my favourite show in jiocinema
jiocinema_search,how do i search for my favourite tv show
jiocinema_search,how do i search for my favourite video
jiocinema_search,how to find my favourite episode
jiocinema_search,how to find my favourite movie
jiocinema_search,how to find my favourite show
jiocinema_search,how to find my favourite tv show
jiocinema_search,how to find my favourite video
jiocinema_search,how to find specific movies
jiocinema_search,how to find specific tv shows
jiocinema_search,how to search for movies of my favourite actor
jiocinema_search,how to search for particular movie
jiocinema_search,how to search for particular tv shows
jiocinema_search,how to search selected movie in jiocinema
jiocinema_search,i want to find my favourite movie
jiocinema_search,search for selected movies in jiocinema
jiocinema_search,way to search favourite movies
jiocinema_search,way to view favourite tv shows
jiocinema_share,can i share content on social pages
jiocinema_share,can i share jiocinema movies with my friends
jiocinema_share,can i share movies from jiocinema on facebook
jiocinema_share,can i share movies from jiocinema on whatsapp
jiocinema_share,can i share videos from jiocinema to facebook
jiocinema_share,can i share videos from jiocinema to whatsapp
jiocinema_share,help me in sharing jiocinema app
jiocinema_share,how to share content from jiocinema on facebook
jiocinema_share,how to share content from jiocinema on social pages
jiocinema_share,how to share jiocinema movies with my friends
jiocinema_share,i want to share jiocinema app
jiocinema_share,is there any feature in jiocinema that allow me to share movies on social media
jiocinema_share,share app on facebook
jiocinema_share,share jiocinema app
jiocinema_share,sharing jiocinema
jiocinema_space,device memory to install jiocinema app
jiocinema_space,devices memory required to install jiocinema app
jiocinema_space,handsets memory required to install jiocinema
jiocinema_space,how much memory i need to download jiocinema
jiocinema_space,how much memory in phone jiocinema use
jiocinema_space,how much space does jiocinema occupy in phone memory
jiocinema_space,how much space i need to download jiocinema
jiocinema_space,how much space jiocinema use
jiocinema_space,memory for jiocinema app
jiocinema_space,memory required for jiocinema
jiocinema_space,memory required to install jiocinema
jiocinema_space,memory space required by jiocinema
jiocinema_space,phones memory required to install jiocinema
jiocinema_space,required memory of jiocinema app
jiocinema_space,size of jiocinema app
jiocinema_space,space occupied by jiocinema
jiocinema_space,space required for jiocinema
jiocinema_space,storage space required by jiocinema
jiocinema_subtitle,can i turn off jiocinema subtitles
jiocinema_subtitle,can i turn on jiocinema subtitle
jiocinema_subtitle,can you play jiocinema subtitles
jiocinema_subtitle,help me in turning on subtitles for jiocinema
jiocinema_subtitle,how can i turn on subtitles for cinema
jiocinema_subtitle,how do i turn on subtitles for movies
jiocinema_subtitle,how to turn on cinema subtitle
jiocinema_subtitle,how to turn on movie subtitle
jiocinema_subtitle,i dont want any subtitles for movies
jiocinema_subtitle,i want to remove jiocinema subtitles
jiocinema_subtitle,is there any option to turn off subtitles of movies
jiocinema_subtitle,is there any option to turn on subtitles of movies
jiocinema_subtitle,jiocinema subtitles of movies
jiocinema_subtitle,process to turn off subtitles for movies
jiocinema_subtitle,process to turn on subtitles for movies
jiocinema_UI_lang,can i change language of jiocinema app
jiocinema_UI_lang,can i change the language of jiocinema app
jiocinema_UI_lang,can i get jiocinema in my regional language
jiocinema_UI_lang,can i have the application in my regional language
jiocinema_UI_lang,display app page in regional language
jiocinema_UI_lang,help me in changing jiocinema system language
jiocinema_UI_lang,how do i change app language
jiocinema_UI_lang,how do i change language in jiocinema
jiocinema_UI_lang,i want jiocinema app in my preferred language
jiocinema_UI_lang,i want to change language in jiocinema app
jiocinema_UI_lang,i want to change system language in jiocinema
jiocinema_UI_lang,is it possible to change language of jiocinema app
jiocinema_unable_to_open,am not able to access jiocinema app
jiocinema_unable_to_open,am not able to open jiocinema app
jiocinema_unable_to_open,am unable to open jiocinema
jiocinema_unable_to_open,i cannot open jiocinema
jiocinema_unable_to_open,i cannot start jiocinema
jiocinema_unable_to_open,jiocinema app is not accessible
jiocinema_unable_to_open,jiocinema app is not opening
jiocinema_unable_to_open,jiocinema does not open
jiocinema_unable_to_open,jiocinema does not start
jiocinema_unable_to_open,jiocinema is not starting
jiocinema_unable_to_open,unable to access jiocinema
jiocinema_update,benefits after updating jiocinema
jiocinema_update,how can i run my jiocinema app without updating
jiocinema_update,i am trying to launch jiocinema on my mobile and its asking me to update what should i do
jiocinema_update,is it important to update jiocinema
jiocinema_update,is it mandatory to update jiocinema
jiocinema_update,is it necessary to update jiocinema
jiocinema_update,is it necessary to update the app
jiocinema_update,jiocinema asking for update what to do
jiocinema_update,jiocinema gives pop up to update app
jiocinema_update,why is it important to update jiocinema app
jiocinema_update,why should i update jiocinema app
jiocinema_update,will it provide any effect if i do not update the jiocinema app
jiocinema_update_content,how often do you modify content on jiocinema
jiocinema_update_content,how often do you renew content on jiocinema
jiocinema_update_content,how often do you update content on jiocinema
jiocinema_update_content,what is the update rate in jiocinema
jiocinema_update_content,when can i get modified content on jiocinema
jiocinema_update_content,when can i get the updated content on jiocinema
jiocinema_update_content,when new movies get added in jiocinema
jiocinema_update_content,when you will add new movies on jiocinema
jiocinema_video_quality_settings,can i increase picture quality of movies of jiocinema
jiocinema_video_quality_settings,can i know the settings of video quality
jiocinema_video_quality_settings,can i set default video quality
jiocinema_video_quality_settings,how can i select the video quality
jiocinema_video_quality_settings,how do i adjust picture quality in jiocinema
jiocinema_video_quality_settings,how to adjust picture quality of movie in jiocinema
jiocinema_video_quality_settings,how to adjust video quality
jiocinema_video_quality_settings,how to improve picture quality of movie in jiocinema
jiocinema_video_quality_settings,how to increase picture quality of movie in jiocinema
jiocinema_video_quality_settings,how to set picture quality of movies
jiocinema_video_quality_settings,picture quality adjustments settings
jiocinema_video_quality_settings,picture quality settings in jiocinema
jiocinema_video_quality_settings,poor video quality movies
jiocinema_video_quality_settings,setting for video quality in jiocinema
jiocinema_video_quality_settings,steps to set picture quality of movies
jiocinema_video_quality_settings,video quality adjustments
jiocinema_video_quality_settings,video quality settings
jiocinema_video_quality_settings,video resolution settings in jiocinema
jiocinema_video_quality_settings,what are the settings for video quality
jiocloud_backup_info,can i set auto backup in jiocloud
jiocloud_backup_info,how do i know if some content on my phone has been backed up to my jiocloud account
jiocloud_backup_info,how to enable auto backup in jiocloud
jiocloud_backup_info,how would i know that my phone data has been synced up to my jiocloud account
jiocloud_backup_info,i want to backup everything automatically in jiocloud
jiocloud_backup_info,is auto backup available in jiocloud
jiocloud_backup_info,let me know if my phone files are synced up to my jiocloud account
jiocloud_backup_info,notify me if content on my phone has been backed up to my jiocloud account
jiocloud_backup_info,what is auto backup in jiocloud
jiocloud_backup_info,why to use auto backup in jiocloud
jiocloud_contacts,find contacts in jiocloud
jiocloud_contacts,i want to see my stored contacts in jiocloud
jiocloud_contacts,i want to view my contacts in jiocloud
jiocloud_contacts,jiocloud contacts
jiocloud_contacts,show contacts in jiocloud
jiocloud_contacts,stored contacts in jiocloud
jiocloud_contacts,take me to stored contacts of jiocloud
jiocloud_contacts,take to my contacts in jiocloud
jiocloud_contacts,where can i find stored contacts in jiocloud
jiocloud_contacts,where can i see contacts in jiocloud
jiocloud_content_security,are my files safe in jiocloud
jiocloud_content_security,are my files secured in jiocloud
jiocloud_content_security,how safe is jiocloud
jiocloud_content_security,how secure is my content on jiocloud
jiocloud_content_security,i want to know about the security on jiocloud
jiocloud_content_security,security of jiocloud
jiocloud_create_folder,can i create folders to categorise files on jiocloud
jiocloud_create_folder,can i make folders to organize files on jiocloud
jiocloud_create_folder,can i organize my data on jiocloud
jiocloud_create_folder,how can i organize my data on jiocloud
jiocloud_create_folder,how to arrange data on jiocloud
jiocloud_create_folder,how to organize files on jiocloud
JioCloud_devices,can i use jiocloud on my device
JioCloud_devices,devices supporting jiocloud
JioCloud_devices,devices that are accessible to use jiocloud
JioCloud_devices,jiocloud compatible devices
JioCloud_devices,jiocloud devices
JioCloud_devices,on which devices can i use jiocloud
JioCloud_devices,which all devices are compatible for using jiocloud
jiocloud_download_info,from where can i download jiocloud
jiocloud_download_info,help me in downloading jiocloud
jiocloud_download_info,help me to download jiocloud
jiocloud_download_info,how can i download jiocloud
jiocloud_download_info,how to download jiocloud
jiocloud_download_info,jiocloud download
jiocloud_download_info,procedure for downloading jiocloud
jiocloud_download_info,procedure to download jiocloud
jiocloud_download_info,where do i download jiocloud from
jiocloud_download_uploaded_file,can a file uploaded from my phone be downloaded to my computer
jiocloud_download_uploaded_file,can i download a file to my computer that i uploaded from my phone
jiocloud_download_uploaded_file,file uploaded from one device be downloaded on other device
jiocloud_download_uploaded_file,upload a file to jiocloud and download to my computer
jiocloud_download_uploaded_file,upload from phone and download to computer
jiocloud_edit_files,can i edit existing files of jiocloud
jiocloud_edit_files,can i make changes to an existing file on jiocloud and then save it again
jiocloud_edit_files,can i modify existing files of jiocloud
jiocloud_edit_files,how to edit files which are already on jiocloud
jiocloud_edit_files,how to make changes to an existing file on jiocloud
jiocloud_edit_files,how to modify existing file on jiocloud
jiocloud_features,features of jiocloud
jiocloud_features,how is jiocloud different from google drive dropbox etc.
jiocloud_features,how is jiocloud different from others
jiocloud_features,tell me about the plus point of jiocloud
jiocloud_features,what are the features of jiocloud
jiocloud_features,what are the important points of jiocloud
jiocloud_features,why should i use jiocloud
jiocloud_files_phone_lost,how secure is my data on jiocloud if my phone is lost
jiocloud_files_phone_lost,is my jiocloud data safe if my phone is lost
jiocloud_files_phone_lost,what happens to my jiocloud content if my phone is lost
jiocloud_files_phone_lost,what happens to my jiocloud files if my device is lost
jiocloud_how_to_delete_account,can i remove jiocloud from mobile
jiocloud_how_to_delete_account,how do i delete my jiocloud account
jiocloud_how_to_delete_account,how to delete jiocloud account
jiocloud_how_to_delete_account,how to remove cloud account
jiocloud_how_to_delete_account,how to remove jiocloud account
jiocloud_how_to_delete_account,i want to remove jiocloud account
jiocloud_info,about jiocloud app
jiocloud_info,brief jiocloud
jiocloud_info,explain jiocloud
jiocloud_info,help me in using jiocloud
jiocloud_info,help me with jiocloud
jiocloud_info,jiocloud what is jiocloud
jiocloud_info,what is jiocloud
jiocloud_locate_access_saved_file,can i access jiocloud files online
jiocloud_locate_access_saved_file,find my files in jiocloud
jiocloud_locate_access_saved_file,find saved files in my jiocloud account
jiocloud_locate_access_saved_file,help me in accessing jiocloud files
jiocloud_locate_access_saved_file,help me in finding saved files in jiocloud
jiocloud_locate_access_saved_file,help me in locating saved files in jiocloud
jiocloud_locate_access_saved_file,how can i access files in jiocloud
jiocloud_locate_access_saved_file,how to find a file i have saved in my jiocloud account
jiocloud_locate_access_saved_file,how to locate a file i have saved in my jiocloud account
jiocloud_locate_access_saved_file,i want to access jiocloud files online
jiocloud_locate_access_saved_file,i want to see my stored files in jiocloud
jiocloud_locate_access_saved_file,i want to view my files in jiocloud
jiocloud_locate_access_saved_file,i want to view my uploaded files
jiocloud_locate_access_saved_file,i want to view my uploaded files from jiocloud
jiocloud_locate_access_saved_file,jiocloud files
