label,expression
latest_jiofi_offer,i want some information about latest jio fi offer by jio
latest_jiofi_offer,i want some information about latest jiofi offer
latest_jiofi_offer,i want some information about latest jiofi offer by jio
latest_jiofi_offer,latest jio fi offer by jio
latest_jiofi_offer,latest jio fi offer launched by jio
latest_jiofi_offer,latest jiofi offer by jio
latest_jiofi_offer,latest jiofi offer launched by jio
latest_jiofi_offer,tell me about latest jio fi offer
latest_jiofi_offer,tell me about latest jiofi offer
latest_jiofi_offer,tell me latest jio fi offer by jio
latest_jiofi_offer,tell me latest jiofi offer by jio
latest_jiofi_offer,what is latest jio fi offer
latest_jiofi_offer,what is latest jiofi offer
latest_jiophone_offer,latest jiophone offer
latest_jiophone_offer,what are the latest jiophone offer from jio
latest_jiophone_offer,what are the latest jiophone offers
latest_jiophone_offer,what are the new latest jiophone offers
latest_jiophone_offer,what are the new offers that you are providing
latest_jiophone_offer,what is the latest jiophone offer
latest_jiophone_offer,what is the latest jiophone offer from jio
latest_jiophone_offer,what is the new latest jiophone offers
latest_jiophone_offer,what is the new offers that you are providing
leaderboard_process,how can i know if my name will be visible in the leaderboard
leaderboard_process,I did not win even when I am on leader board
leaderboard_process,I have the same points as someone else but my name is not on the Leaderboard. Does that have any implication
leaderboard_process,I have won still my name is not on leader board
leaderboard_process,i want to be in the leaderboard
leaderboard_process,My name is on the Leaderboard why have I not won a prize
leaderboard_process,my points are same as other still I am not on leader board
leaderboard_process,my points are same as other still my name is not on leader board
leaderboard_process,what is the leaderboard process
leaderboard_process,who can be on the leaderboard
leaderboard_process,who will be in leaderboard
leaderboard_process,why I did not won the prize
leaderboard_process,will my name display in leaderboard
lg,I want to know about lg offer from jio
lg,jio offer for lg phones
lg,lg offer by jio
lg,lg offer from jio
lg,offers for lg from jio
lg,what are the latest lg offer
lg,what offer does lg provides
link_aadhar_to_sim,from where to link aadhar to my sim
link_aadhar_to_sim,how can i link my aadhar card number with my jio number myself
link_aadhar_to_sim,how to link aadhar card to my jio sim
link_aadhar_to_sim,I want to link aadhar card to my jio sim
link_pancard_with_jio,can I link my pan card account with jio account
link_pancard_with_jio,can I link my pan card number with jio account
link_pancard_with_jio,help me in linking my pan card with jio account
link_pancard_with_jio,how can I link my pan card with jio account
link_pancard_with_jio,I want to link my pan card with jio account
list_linked_account,check my linked accounts list
list_linked_account,check my linked number list
list_linked_account,give me list of all linked account
list_linked_account,give me list of all linked numbers
list_linked_account,give me the list of accounts linked with myjio
list_linked_account,give me the list of number linked with myjio
list_linked_account,how many accounts are linked to myjio
list_linked_account,how many accounts do i have linked
list_linked_account,how many jio account
list_linked_account,how many number are linked to myjio
list_linked_account,how many number do i have linked
list_linked_account,list of linked account
list_linked_account,list of linked accounts
list_linked_account,list of linked number
list_linked_account,list of linked numbers
list_linked_account,myjio numbers
list_linked_account,show all list of linked account
list_linked_account,show all list of linked numbers
list_linked_account,show me added linked account list
list_linked_account,show me added linked numbers list
list_linked_account,show me list of all those accounts which are linked with myjio account
list_linked_account,show me list of all those number which are linked with my jio numbers
list_linked_account,show me my linked numbers
list_linked_account,show my all jio mobile numbers
list_linked_account,show my all jio numbers
list_linked_account,show my link numbers
list_linked_account,show my linked numbers
list_linked_account,show myjio mobile numbers
list_linked_account,total linked account
list_linked_account,total linked numbers
list_linked_account,what are my jio numbers
list_linked_account,what are myjio mobile numbers
list_linked_account,what numbers are linked to my account
list_linked_account,which all accounts are linked in myjio
list_linked_account,which all number are linked in myjio
locate_my_phone,can you locate my phone please
locate_my_phone,find my device
locate_my_phone,find my mobile phone
locate_my_phone,find my phone
locate_my_phone,locate my device dev
locate_my_phone,locate my mobile mob
locate_my_phone,locate my phone ph
location_specific_network_issue,I face network issues at my area
location_specific_network_issue,I face network issues at my place
location_specific_network_issue,I face network issues in my area
location_specific_network_issue,I face network issues in my locality
location_specific_network_issue,I face network issues in my place
location_specific_network_issue,I face sim issues at my area
location_specific_network_issue,I face sim issues at my place
location_specific_network_issue,I face sim issues in my area
location_specific_network_issue,I face sim issues in my locality
location_specific_network_issue,I face sim issues in my place
location_specific_network_issue,jio network has issues at my area
location_specific_network_issue,jio network has issues at my place
location_specific_network_issue,jio network has issues in my area
location_specific_network_issue,jio network has issues in my locality
location_specific_network_issue,jio network has issues in my place
location_specific_network_issue,jio sim has issues at my area
location_specific_network_issue,jio sim has issues at my place
location_specific_network_issue,jio sim has issues in my area
location_specific_network_issue,jio sim has issues in my locality
location_specific_network_issue,jio sim has issues in my place
location_specific_network_issue,network problem occurring at my area
location_specific_network_issue,network problem occurring at my place
location_specific_network_issue,network problem occurring in my area
location_specific_network_issue,network problem occurring in my locality
location_specific_network_issue,network problem occurring in my place
location_specific_network_issue,sim problem occurring at my area
location_specific_network_issue,sim problem occurring at my place
location_specific_network_issue,sim problem occurring in my area
location_specific_network_issue,sim problem occurring in my locality
location_specific_network_issue,sim problem occurring in my place
location_specific_network_issue,there are lot of network issues at my area
location_specific_network_issue,there are lot of network issues at my place
location_specific_network_issue,there are lot of network issues in my area
location_specific_network_issue,there are lot of network issues in my locality
location_specific_network_issue,there are lot of network issues in my place
location_specific_network_issue,there are lot of sim issues at my area
location_specific_network_issue,there are lot of sim issues at my place
location_specific_network_issue,there are lot of sim issues in my area
location_specific_network_issue,there are lot of sim issues in my locality
location_specific_network_issue,there are lot of sim issues in my place
location_specific_network_issue,your network does not work at my area
location_specific_network_issue,your network does not work at my place
location_specific_network_issue,your network does not work in my area
location_specific_network_issue,your network does not work in my locality
location_specific_network_issue,your network does not work in my place
location_specific_network_issue,your sim does not work at my area
location_specific_network_issue,your sim does not work at my place
location_specific_network_issue,your sim does not work in my area
location_specific_network_issue,your sim does not work in my locality
location_specific_network_issue,your sim does not work in my place
lost_sim,block my jio sim from misuse
lost_sim,how can i get my jio sim blocked
lost_sim,I am unable to find my jio sim
lost_sim,i have damaged my sim what do i do
lost_sim,i have lost my sim please suspend
lost_sim,i have lost my sim what do i do
lost_sim,i have misplaced the sim what do i do
lost_sim,I want to block my jio sim
lost_sim,I want to block my sim
lost_sim,jio sim is damaged
lost_sim,jio sim is misplaced
lost_sim,my another jio sim is stolen so how toh block that sim
lost_sim,my number sim replace mant
lost_sim,my phone is stolen block my jio sim
lost_sim,my sim is broken
lost_sim,my sim is misplaced block it from misuse
lost_sim,want to block my jio sim
lte_info,brief lte
lte_info,describe lte
lte_info,explain lte
lte_info,tell me something about lte
lte_info,what is lte
lte_phones_list,4g lte phones
lte_phones_list,four g lte phones
lte_phones_list,give me a list of devices that work on jio network for data
lte_phones_list,give me the list of lte phones
lte_phones_list,lte enable phones
lte_phones_list,lte phones
lte_phones_list,show me list of lte compatible phones
lte_phones_list,what are lte devices
lte_phones_list,what are the list of lte devices
lte_phones_list,which device will work on jionetwork for data
lte_phones_list,which devices will work on jio network for data
lte_phones_list,which lte handsets phones are available in the market
lyf_brand_info,are lyf devices 4g compatible
lyf_brand_info,compatible lyf devices for jio 4g
lyf_brand_info,do you have information on jio lyf
lyf_brand_info,give me some information about lyf
lyf_brand_info,is my lyf device 4g compatible
lyf_brand_info,is my lyf phone support for jio 4g
lyf_brand_info,on which lyf devices can i use 4g
lyf_brand_info,on which lyf devices can i use jio 4g
lyf_brand_info,on which lyf devices can i use volte
lyf_brand_info,provide me information on jio lyf
lyf_brand_info,tell me something about lyf
lyf_brand_info,what is jio lyf
lyf_brand_info,what is lyf
lyf_brand_info,what is your lyf
lyf_brand_info,whats lyf
lyf_brand_info,which all lyf devices are compatible for 4g connection
lyf_brand_info,which all lyf devices are compatible for jio 4g
lyf_brand_info,which all lyf devices support jio 4g
lyf_brand_info,which lyf devices are 4g compatible
lyf_customer_care,lyf customer care
lyf_customer_care,lyf customer care contact number
lyf_customer_care,lyf customer care phone number
lyf_customer_care,lyf helpline number
lyf_customer_care,lyf jiocare no
lyf_customer_care,tell me lyf jiocare number
lyf_customer_care,what is the contact number of lyf customer care
lyf_device_where_to_buy,where can i buy a lyf phone
lyf_device_where_to_buy,where can i buy lyf devices
lyf_device_where_to_buy,where can i order lyf device
lyf_device_where_to_buy,where can i purchase lyf device
lyf_device_where_to_buy,where will i get lyf devices
lyf_earth_series,i want to buy lyf earth phone
lyf_earth_series,i want to buy lyf earth smartphone
lyf_earth_series,i want to check lyf earth 1
lyf_earth_series,i want to check lyf earth 2
lyf_earth_series,i want to get earth device
lyf_earth_series,i want to see earth 1
lyf_earth_series,i want to see lyf water series
lyf_earth_series,show me earth 1
lyf_earth_series,what is lyf earth
lyf_earth_series,what is the cost of earth 1
lyf_earth_series,what is the cost of lyf earth smartphones
lyf_flame_series,i want to buy lyf flame phone
lyf_flame_series,i want to buy lyf flame smartphone
lyf_flame_series,i want to get flame device
lyf_flame_series,lyf flame smartphones
lyf_flame_series,what are lyf flame series
lyf_flame_series,what are the models of lyf flame
lyf_flame_series,what is lyf flame
lyf_jio_sim_other_mobile,can i use the jio sim card that comes with lyf mobile in other mobile
lyf_jio_sim_other_mobile,can jio sim with lyf handset be used in other handsets
lyf_locate_service_centre,can you locate lyf service centre near me
lyf_locate_service_centre,error with my lyf device
lyf_locate_service_centre,error with my lyf handset
lyf_locate_service_centre,error with my lyf mobile
lyf_locate_service_centre,error with my lyf phone
lyf_locate_service_centre,help me to solve issue on lyf device
lyf_locate_service_centre,help me to solve issue on lyf handset
lyf_locate_service_centre,help me to solve issue on lyf mobile
lyf_locate_service_centre,help me to solve issue on lyf phone
lyf_locate_service_centre,i am facing issue with my lyf device
lyf_locate_service_centre,i am facing issue with my lyf handset
lyf_locate_service_centre,i am facing issue with my lyf mobile
lyf_locate_service_centre,i am facing issue with my lyf phone
lyf_locate_service_centre,i am facing problems with lyf device
lyf_locate_service_centre,i am facing problems with lyf handset
lyf_locate_service_centre,i am facing problems with lyf mobile
lyf_locate_service_centre,i am facing problems with lyf phone
lyf_locate_service_centre,is lyf service centre near me
lyf_locate_service_centre,locate lyf service centre
lyf_locate_service_centre,lyf device is broken
lyf_locate_service_centre,lyf device is not functioning
lyf_locate_service_centre,lyf handset is broken
lyf_locate_service_centre,lyf handset is not functioning
lyf_locate_service_centre,lyf is functionless
lyf_locate_service_centre,lyf is not working
lyf_locate_service_centre,lyf mobile is broken
lyf_locate_service_centre,lyf mobile is not functioning
lyf_locate_service_centre,lyf phone is broken
lyf_locate_service_centre,lyf phone is not functioning
lyf_locate_service_centre,lyf service centre
lyf_locate_service_centre,my lyf device is not working
lyf_locate_service_centre,my lyf handset is not working
lyf_locate_service_centre,my lyf mobile is not working
lyf_locate_service_centre,my lyf phone is not working
lyf_locate_service_centre,problems in lyf device
lyf_locate_service_centre,problems in lyf handset
lyf_locate_service_centre,problems in lyf mobile
lyf_locate_service_centre,problems in lyf phone
lyf_locate_service_centre,where can i find a lyf service centre
lyf_locate_service_centre,where is lyf service centre located
lyf_locate_service_centre,why my lyf device is not working
lyf_locate_service_centre,why my lyf handset is not working
lyf_locate_service_centre,why my lyf mobile is not working
lyf_locate_service_centre,why my lyf phone is not working
LYF_product,can i buy a white lyf phone
LYF_product,do lyf phones come in marigold
LYF_product,jio mobiles
LYF_product,offers on lyf smartphones
LYF_product,products available on jio website
LYF_product,products available on jio website for buying
LYF_product,products available on jio website for purchase
LYF_product,reliance mobiles
LYF_product,things available on jio website
LYF_product,things available on jio website for buying
LYF_product,things available on jio website for purchase
LYF_product,what all things i can buy on the jio website
LYF_product,what all things i can purchase on the jio website
LYF_product,what are lyf devices
LYF_product,what can i buy on the jio website
LYF_product,what can i purchase on the jio website
LYF_product,what colours of lyf phones
LYF_product,what is latest lyf phone
LYF_product,what is lyf smartphone
LYF_product,what is the latest lyf phone
LYF_product,what products i can buy on the jio website
LYF_product,what products i can purchase on the jio website
LYF_product,what smartphone does jio offers
LYF_product,what smartphones does lyf include
LYF_product,which are the different lyf collections
LYF_product,which are the different lyf phone collections
LYF_product,which lyf phone can i purchase today
LYF_product,which lyf phone has the longest battery life
LYF_product,which lyf phone is the best for selfies
LYF_product,which lyf phone should i buy
LYF_product,which phones are better earth or wind
lyf_water_series,i want to buy lyf water phone
lyf_water_series,i want to buy lyf water smartphone
lyf_water_series,i want to get water device
lyf_water_series,lyf water smartphones
lyf_water_series,what are the models of lyf water
lyf_water_series,what is lyf water
lyf_water_series,what is the cost of lyf water smartphone
lyf_wind_series,i want to buy lyf wind phone
lyf_wind_series,i want to buy lyf wind smartphone
lyf_wind_series,i want to get wind device
lyf_wind_series,lyf wind smartphones
lyf_wind_series,what are the models of lyf wind
lyf_wind_series,what is lyf wind
lyf_wind_series,what is the cost of lyf wind smartphone
make_isd_call,can you help me in making a international call
make_isd_call,can you help me in making a isd call
make_isd_call,how can i call to international numbers
make_isd_call,how can I do international call
make_isd_call,how can I do isd call
make_isd_call,how do I make a international call
make_isd_call,how do I make a isd call
make_isd_call,how do i make international calls
make_isd_call,i want to make a international call
make_isd_call,I want to make an isd call
make_isd_call,isd call
make_isd_call,make a international call
make_isd_call,make a isd call
make_isd_call,steps to make a international call
make_isd_call,steps to make a isd call
make_isd_call,What are the charges to call dubai
make_isd_call,what are the charges to call isd
make_isd_call,what is the charge to call outside india
maximim_devices_connected_jiofi,can i connect five devices to jiofi at a time
maximim_devices_connected_jiofi,how many devices can i connect to jiofi
maximim_devices_connected_jiofi,how many devices will jiofi support
maximim_devices_connected_jiofi,is it possible to connect ten devices at a time with jiofi
maximim_devices_connected_jiofi,maximum number of devices that can be connected to jiofi at a time
maximum_sim_per_user,can i buy multiple jio sims
maximum_sim_per_user,can i buy three jio sims
maximum_sim_per_user,can i get multiple jio sim from jio store
maximum_sim_per_user,how many jio sim can i buy on one id proof
maximum_sim_per_user,how many jio sims can i purchase
maximum_sim_per_user,jio sim cards i can buy
maximum_sim_per_user,maximum number of jio sim under my name
micromax,I want to know about micromax offer from jio
micromax,jio offer for micromax phones
micromax,micromax offer by jio
micromax,micromax offer from jio
micromax,offers for micromax from jio
micromax,what are the latest micromax offer
micromax,what offer does micromax provides
miss_india_digital_contest_duration,expiry date for jio main bhi miss india digital contest expire
miss_india_digital_contest_duration,expiry time for jio main bhi miss india digital contest expire
miss_india_digital_contest_duration,is there any expiry date for jio main bhi miss india digital contest expire
miss_india_digital_contest_duration,is there any validity for jio main bhi miss india digital contest validity
miss_india_digital_contest_duration,jio main bhi miss india digital contest expiry date expire
miss_india_digital_contest_duration,till what time jio main bhi miss india digital contest exist
miss_india_digital_contest_duration,what is the duration of the jio main bhi miss india digital contest duration
miss_india_digital_contest_duration,what is validity of jio main bhi miss india digital contest validity
miss_india_digital_contest_duration,what is validity of this jio main bhi miss india digital contest
miss_india_digital_contest_duration,what is validity of this jio main bhi miss india digital contest validity
miss_india_digital_contest_duration,when will jio main bhi miss india digital contest expires expire
miss_india_digital_contest_info,am i eligible to participate in jio main bhi miss india digital contest
miss_india_digital_contest_info,can you tell me something about jio main bhi miss india digital contest
miss_india_digital_contest_info,can you tell me something about jio miss india digital contest
miss_india_digital_contest_info,criteria to get part in jio main bhi miss india digital contest
miss_india_digital_contest_info,eligibility for jio main bhi miss india digital contest
miss_india_digital_contest_info,eligibility to participate in jio main bhi miss india digital contest
miss_india_digital_contest_info,i want to know about jio main bhi miss india digital contest
miss_india_digital_contest_info,i want to know about jio miss india digital contest
miss_india_digital_contest_info,is there any criteria for jio main bhi miss india digital contest
miss_india_digital_contest_info,is there any limit for jio main bhi miss india digital contest
miss_india_digital_contest_info,jio main bhi miss india digital contest
miss_india_digital_contest_info,jio main bhi miss india digital contest info
miss_india_digital_contest_info,jio miss india digital contest
miss_india_digital_contest_info,jio miss india digital contest info
miss_india_digital_contest_info,tell me about jio main bhi miss india digital contest
miss_india_digital_contest_info,tell me about jio miss india digital contest
miss_india_digital_contest_info,what do you know about jio main bhi miss india digital contest
miss_india_digital_contest_info,what do you know about jio miss india digital contest
miss_india_digital_contest_info,what is jio main bhi miss india digital contest
miss_india_digital_contest_info,what is jio miss india digital contest
miss_india_digital_contest_info,who can participate in jio main bhi miss india digital contest
miss_india_digital_contest_info,who is eligible for jio main bhi miss india digital contest
miss_india_digital_contest_registraion,are there any particular process for jio main bhi miss india digital contest registration
miss_india_digital_contest_registraion,can you help me with jio main bhi miss india digital contest registration
miss_india_digital_contest_registraion,can you help me with registration for jio main bhi miss india digital contest
miss_india_digital_contest_registraion,give me process to register for jio main bhi miss india digital contest
miss_india_digital_contest_registraion,help me to register with jio main bhi miss india digital contest
miss_india_digital_contest_registraion,help me with registration of jio main bhi miss india digital contest
miss_india_digital_contest_registraion,how should i do registration for jio main bhi miss india digital contest
miss_india_digital_contest_registraion,register for jio main bhi miss india digital contest
miss_india_digital_contest_registraion,what is the registration process for jio main bhi miss india digital contest
missing_channel_jiotv,can i suggest channels for jiotv
missing_channel_jiotv,certain channels are missing on jiotv
missing_channel_jiotv,how can i provide feedback about missing channel
missing_channel_jiotv,how can i suggest about missing channel
missing_channel_jiotv,how to add certain channels to jiotv
missing_channel_jiotv,i can_t find few channels that i want to watch how do i get them
missing_channel_jiotv,i cant find my favourite channel
missing_channel_jiotv,i want to include a few channels on jiotv
missing_channel_jiotv,i want to suggest channels for jiotv
missing_channel_jiotv,i want you to include few channels in jiotv
missing_channel_jiotv,my favourite channel is missing
missing_channel_jiotv,provide me information on jiotv missing channel
missing_movie_show_jiocinema,am not able to find some movies in jiocinema
missing_movie_show_jiocinema,can i suggest movies for jiocinema
missing_movie_show_jiocinema,certain movies are missing in jiocinema
missing_movie_show_jiocinema,how can i suggest a movie
missing_movie_show_jiocinema,how can i suggest about missing cinema
missing_movie_show_jiocinema,how to add certain movies to jiocinema
missing_movie_show_jiocinema,how to suggest some movies to jiocinema
missing_movie_show_jiocinema,i cant find my favourite movie
missing_movie_show_jiocinema,i want to include few movies in jiocinema
missing_movie_show_jiocinema,i want to suggest movies for jiocinema
missing_movie_show_jiocinema,my favourite movie is missing
missing_movie_show_jiocinema,some movies are missing in jiocinema
missing_movie_show_jiocinema,some movies are not available in jiocinema
missing_movie_show_jiocinema,why all movies are not available in jiocinema
missing_publication_jioxpressnews,add certain publication to jio express news
missing_publication_jioxpressnews,add the hindu publication to jio express news
missing_publication_jioxpressnews,add the hindu to jio express news
missing_publication_jioxpressnews,at certain publication to jio express news
missing_publication_jioxpressnews,can i suggest publication for jioexpressnews
missing_publication_jioxpressnews,certain publication are missing on jioexpressnews
missing_publication_jioxpressnews,how can i provide feedback about missing publication
missing_publication_jioxpressnews,how can i recommend a specific publication for jioexpressnews
missing_publication_jioxpressnews,how can i recommend a specific publication for jioxpressnews
missing_publication_jioxpressnews,how can i suggest a specific publication which is not available on jioexpressnews
missing_publication_jioxpressnews,how can i suggest a specific publication which is not available on jioxpressnews
missing_publication_jioxpressnews,how can i suggest about missing publication
