label,expression
redeem_voucher_info,i want to redeem my voucher
redeem_voucher_info,redeem voucher
redeem_voucher_info,redeem vouchers
redeem_voucher_info,when during recharge do i use voucher
redeem_voucher_info,why you have not given me cash back as i have recharged my jio
redmi,redmi offer
redmi,tell me somethong about redmi offer
redmi5A_offer,additional data offer for redmi 5a phones
redmi5A_offer,How long is the jio redmi 5a additional data offer valid for
redmi5A_offer,How long is the jio redmi 5a offer valid for
redmi5A_offer,how much additional data i will get from jio offer of redmi 5a phones
redmi5A_offer,how to get benefits of redmi 5a offer
redmi5A_offer,i bought redmi 5a how can i get jio benefits
redmi5A_offer,i want information redmi 5a offer
redmi5A_offer,i want information redmi 5a offer from jio
redmi5A_offer,i want to know about redmi 5a offer
redmi5A_offer,i want to know about redmi 5a offer from jio
redmi5A_offer,information about redmi 5 offer
redmi5A_offer,information about redmi 5a offer
redmi5A_offer,is there any offer for redmi 5a phones from jio
redmi5A_offer,is there any special offer for redmi 5a phones
redmi5A_offer,jio offer for redmi 5a phones
redmi5A_offer,jio offers related to redmi 5
redmi5A_offer,jio offers related to redmi 5a
redmi5A_offer,offer for redmi 5a phones
redmi5A_offer,offer provided to redmi 5a from jio
redmi5A_offer,redmi 5 offer
redmi5A_offer,redmi 5 offer provided by jio
redmi5A_offer,redmi 5a offer
redmi5A_offer,redmi 5a offer provided by jio
redmi5A_offer,redmi offer
redmi5A_offer,redmi offers
redmi5A_offer,show me redmi 5a offer
redmi5A_offer,show me redmi 5a offer from jio
redmi5A_offer,tell me about redmi 5 offer
redmi5A_offer,tell me about redmi 5a offer
redmi5A_offer,tell me redmi 5a offer
redmi5A_offer,tell me redmi 5a offer from jio
redmi5A_offer,tell me something about redmi 5a offer
redmi5A_offer,validity of jio offer for redmi 5a phones
redmi5A_offer,validity of redmi 5a phone jio offer
redmi5A_offer,what is redmi 5 offer
redmi5A_offer,what is redmi 5a offer
refund_amount,by what means i will get my money back
refund_amount,by what means i will get my refund
refund_amount,by what modes i will get my money back
refund_amount,by what modes i will get my refund
refund_amount,how long does it take for a refund to be reflected in my account
refund_amount,how much amount will get refunded to me
refund_amount,how will i get my money back
refund_amount,how will i get my money back on order cancellation
refund_amount,how will i get my payment back
refund_amount,how will i get refund
refund_amount,how will i receive refund amount
refund_amount,I want full refund
refund_amount,I want my refund back
refund_amount,I want refund
refund_amount,mode of my refund
refund_amount,what amount will get refunded to me
refund_amount,what are the modes of refund available after cancellation
refund_amount,what happens to the money I have paid when i cancel my order
refund_amount,what will be the mode of getting my money back
refund_amount,what will be the mode of getting my payment back
refund_amount,what will be the mode of my refund
refund_amount,will I receive whole amount as refund
refund_time,how long will it take to get my amount back
refund_time,how long will it take to get my money back
refund_time,how long will it take to get my payment back
refund_time,how long will it take to receive the refund
refund_time,how long will it take to receive the refund for my returned item
refund_time,how much time will it take to get my amount back
refund_time,how much time will it take to get my money back
refund_time,how much time will it take to get my payment back
refund_time,how much time will it take to receive the refund
refund_time,how much time will it take to receive the refund for my returned item
refund_time,in how many days will i get my amount back
refund_time,in how many days will i get my money back
refund_time,in how many days will i get my payment back
refund_time,in how many days will i receive the refund
refund_time,when will I receive my refund
reliance_foundation_info,akash anant isha mukesh nita
reliance_foundation_info,and who is the owner of jio
reliance_foundation_info,browse founder of jio
reliance_foundation_info,founder of reliance
reliance_foundation_info,jio owner
reliance_foundation_info,mukesh ambani
reliance_foundation_info,mukesh ambani who is
reliance_foundation_info,reliance foundation
reliance_foundation_info,reliance foundation info
reliance_foundation_info,tell me something about reliance foundation
reliance_foundation_info,the owner of jio
reliance_foundation_info,what is reliance foundation
reliance_foundation_info,when was jio launched
reliance_foundation_info,who is akash ambani
reliance_foundation_info,who is akash ambanis brother
reliance_foundation_info,who is akash ambanis sister
reliance_foundation_info,who is anant ambani
reliance_foundation_info,who is anant ambanis sister
reliance_foundation_info,who is dhirubhai ambanis son
reliance_foundation_info,who is founder of reliance
reliance_foundation_info,who is isha ambani
reliance_foundation_info,who is isha ambanis brother
reliance_foundation_info,who is managing director of reliance industries
reliance_foundation_info,who is mukesh ambani
reliance_foundation_info,who is mukesh ambanis daughter
reliance_foundation_info,who is mukesh ambanis elder son
reliance_foundation_info,who is mukesh ambanis wife
reliance_foundation_info,who is mukesh ambanis younger son
reliance_foundation_info,who is nita ambani
reliance_foundation_info,who is nita ambanis daughter
reliance_foundation_info,who is nita ambanis elder son
reliance_foundation_info,who is nita ambanis husband
reliance_foundation_info,who is nita ambanis younger son
reliance_foundation_info,who is the ceo of jio
reliance_foundation_info,who is the chairman of jio
reliance_foundation_info,who is the chairman of reliance industries
reliance_foundation_info,who is the founder of jio
reliance_foundation_info,who is the managing director of jio
reliance_foundation_info,who is the owner of jio
reliance_foundation_info,who is your owner
reliance_foundation_info,who runs reliance foundation
reliance_foundation_info,who runs reliance industries
reliance_foundation_info,who runs reliance jio
reliance_foundation_info,who stats reliance foundation
reliance_fresh,can i buy vegetables in reliance fresh
reliance_fresh,i want to know about reliance fresh
reliance_fresh,inform me about reliance fresh
reliance_fresh,information about reliance fresh
reliance_fresh,reliance fresh
reliance_fresh,reliance fresh information
reliance_fresh,tell me something about reliance fresh
reliance_fresh,what is reliance fresh
reliance_jewels,can i buy jewels in reliance jewels
reliance_jewels,i want to know about reliance jewels
reliance_jewels,inform me about reliance jewels
reliance_jewels,information about reliance jewels
reliance_jewels,reliance jewels
reliance_jewels,reliance jewels information
reliance_jewels,tell me something about reliance jewels
reliance_jewels,what is reliance jewels
reliance_trends_store_locator,find me nearest reliance trend
reliance_trends_store_locator,find me the nearest reliance store
reliance_trends_store_locator,how do i find the nearest reliance store
reliance_trends_store_locator,locate nearest reliance trends
reliance_trends_store_locator,reliance trends shops near me
reliance_trends_store_locator,search nearest reliance store
reliance_trends_store_locator,search reliance trends store
reliance_trends_store_locator,show me reliance stores
republic_day_offer,can i get special plans for republic day
republic_day_offer,can i get special plans for republic day 2018
republic_day_offer,can you tell me about the new plan of republic day is also beneficial for the customer who already recharge on december 2017
republic_day_offer,how can i get my data 2 gb per day my plan is already 399 but i want to upgrade my plan per day 2gb i won't get up to 1 month
republic_day_offer,i have recharged with 399 already will i get benifits of republic day offer
republic_day_offer,i want some information about jio plans for republic day
republic_day_offer,i want some information about jio plans for republic day 2018
republic_day_offer,i want to know about jio plans for republic day
republic_day_offer,i want to know about jio plans for republic day 2018
republic_day_offer,i want to know republic day offer from jio for
republic_day_offer,i want to know republic day offer from jio for 2018
republic_day_offer,is jio offering any special plans on republic day
republic_day_offer,is jio offering any special plans on republic day 2018
republic_day_offer,is there any plans from jio for republic day
republic_day_offer,is there any plans from jio for republic day 2018
republic_day_offer,is there any special plans for republic day
republic_day_offer,is there any special plans for republic day 2018
republic_day_offer,jio plans for republic day
republic_day_offer,jio plans for republic day 2018
republic_day_offer,jio republic day offers
republic_day_offer,plans for republic day 2018 offers
republic_day_offer,plans for republic day offers
republic_day_offer,plans offered by jio for republic day
republic_day_offer,plans offered by jio for republic day 2018
republic_day_offer,republic day 2018 plans
republic_day_offer,republic day 2018 plans from jio
republic_day_offer,republic day offer of jio tariff plans
republic_day_offer,republic day offers
republic_day_offer,republic day plans
republic_day_offer,republic day plans from jio
republic_day_offer,republic day plans from jio 2018
republic_day_offer,show me the jio republic offer
republic_day_offer,what are jio republic day 2018 plans
republic_day_offer,what are jio republic day plans
republic_day_offer,what is republic day 2018 offer
republic_day_offer,what is republic day offer
republic_day_offer,what is the offer for 26th january
republic_day_offer,when i will just get the benefit of republic day offer
restart_device,can you restart my device
restart_device,please restart my device
restart_device,restart device
restart_device,restart my device
return_product,am not satisfied with product how to exchange it
return_product,am not satisfied with product how to return it
return_product,can I exchange my order
return_product,can I return my order
return_product,can i return my package
return_product,can I return my product
return_product,how can I exchange my order
return_product,how can I exchange my package
return_product,how can I exchange my product
return_product,how can I return my order
return_product,how can I return my package
return_product,how can I return my product
return_product,how do i return my package
return_product,how to exchange my order
return_product,how to give back my order
return_product,how to give back my package
return_product,how to give back my product
return_product,i got damaged product how do i return it
return_product,I received damaged product how do i exchange it
return_product,I received damaged product how do i return it
return_product,I received wrong order how do i exchange it
return_product,I received wrong order how do i return it
return_product,I want to exchange my order
return_product,I want to exchange my package
return_product,I want to exchange my product
return_product,I want to return my order
return_product,i want to return my package
return_product,I want to return my product
return_product,procedure to return my order
return_product,procedure to return my product
return_product,to whom i have to contact for product return
return_product,way to return order
return_product,way to return product
samsung,I want to know about samsung offer from jio
samsung,is there any special offer for samsung
samsung,jio offer for samsung phones
samsung,offers for samsung from jio
samsung,samsung offer by jio
samsung,samsung offer from jio
samsung,what are the latest samsung offer
samsung,what offer does samsung provides
samsung_galaxyj2_cashback,how and when will i get the cashback and data under the samsung galaxy j2 2018 jio cashback and additional data offer
samsung_galaxyj2_cashback,how can i know galaxy j2 cashback is credited to my account
samsung_galaxyj2_cashback,how can i redeem cashback on samsung galaxy j2 offer
samsung_galaxyj2_cashback,how can i redeem cashback voucher on samsung galaxy j2 offer
samsung_galaxyj2_cashback,how will i get to know if the cashback or partner or data vouchers under the samsung galaxy j2 2018 jio cashback and additional data offer 2018 has been credited to my account
samsung_galaxyj2_cashback,i dont know how to get my cashback on samsung galaxy j2 offer
samsung_galaxyj2_cashback,i dont know how to get my cashback voucher on samsung galaxy j2 offer
samsung_galaxyj2_cashback,i dont know when to get my cashback on samsung galaxy j2 offer
samsung_galaxyj2_cashback,i dont know when to get my cashback voucher on samsung galaxy j2 offer
samsung_galaxyj2_cashback,i want to know if galaxy j2 cashback is credited to my account
samsung_galaxyj2_cashback,i want to redeem cashback on samsung galaxy j2 offer
samsung_galaxyj2_cashback,i want to redeem cashback voucher on samsung galaxy j2 offer
samsung_galaxyj2_cashback,i want to view galaxy j2 cashback voucher
samsung_galaxyj2_cashback,redeem samsung galaxy j2 offer
samsung_galaxyj2_cashback,when can i redeem cashback on samsung galaxy j2 offer
samsung_galaxyj2_cashback,when can i redeem cashback voucher on samsung galaxy j2 offer
samsung_galaxyj2_cashback,where can i view galaxy j2 cashback voucher
samsung_galaxyj2_datavouchervalidity,can you show me validity for samsung galaxy j2 2018 jio cashback for data voucher
samsung_galaxyj2_datavouchervalidity,can you tell me when is my expiration date for samsung galaxy j2 2018 data voucher
samsung_galaxyj2_datavouchervalidity,check my date for expiry for samsung galaxy j2 data voucher
samsung_galaxyj2_datavouchervalidity,end date of my samsung galaxy j2 data voucher
samsung_galaxyj2_datavouchervalidity,end time of my samsung galaxy j2 data voucher
samsung_galaxyj2_datavouchervalidity,expiry date of my samsung galaxy j2 voucher
samsung_galaxyj2_datavouchervalidity,what will be the validity of the cashback vouchers and additional data voucher given under the samsung galaxy j2 2018 jio cashback and additional data offer 2018 offer
samsung_galaxyj2_device,galaxy device that is eligible for j2 offer
samsung_galaxyj2_device,i want to know if my device is eligible for samsung galaxy j2 offer
samsung_galaxyj2_device,samsung galaxy models that are eligible for galaxy j2 offer
samsung_galaxyj2_device,which galaxy phone is eligible for galaxy j2 offer
samsung_galaxyj2_device,which samsung galaxy models are eligible for the offer
samsung_galaxyj2_device,will the samsung galaxy j2 2018 jio cashback and additional data offer 2018 offer be available if i switch my jio number to any other samsung mobile or other device manufacturers
samsung_galaxyj2_eligibility,am i eligible for samsung galaxy j2 offer
samsung_galaxyj2_eligibility,how do i earn eligibility for samsung galaxy j2 offer
samsung_galaxyj2_eligibility,i want to earn eligibility for samsung galaxy j2 offer
samsung_galaxyj2_eligibility,what are the ways for eligibilty for samsung galaxy j2 offer
samsung_galaxyj2_eligibility,what is the eligibility criteria for availing the samsung galaxy j2 2018 jio cashback and additional data offer
samsung_galaxyj2_offer,can i get samsung galaxy j2 offer
samsung_galaxyj2_offer,can you please tell me about samsung galaxy offer
samsung_galaxyj2_offer,help me to know about samsung galaxy j2 offer
samsung_galaxyj2_offer,i need to know about samsung galaxy j2 offer
samsung_galaxyj2_offer,is the samsung galaxy j2 2018 jio cashback and additional data offer 2018 applicable to existing jio subscribers as well
samsung_galaxyj2_offer,please tell me about samsung galaxy j2 offer
samsung_galaxyj2_offer,samsung galaxy j2 offer
samsung_galaxyj2_offer,samsung galaxy j2 offer is for existing jio customers
samsung_galaxyj2_offer,tell me about samsung galaxy j2 offer
samsung_galaxyj2_offer,what is samsung galaxy j2 offer
samsung_galaxyj2_transfervoucher,can i transfer my cashback to any other jio number
samsung_galaxyj2_transfervoucher,can the cashback vouchers or additional data voucher under the samsung galaxy j2 2018 jio cashback and additional data offer 2018 offer be transferred to any other jio number
samsung_galaxyj2_transfervoucher,help me in transfering cashback to other jio number
samsung_galaxyj2_transfervoucher,i want to transfer my cashback to other jio number
samsung_galaxyj2_transfervoucher,please transfer my cashback to other jio number
samsung_galaxyj2_validity,can you show me validity for samsung galaxy j2 2018 jio cashback
samsung_galaxyj2_validity,can you tell me when is my expiration date for samsung galaxy j2 2018 jio cashback
samsung_galaxyj2_validity,check my date for expiry for samsung galaxy j2 offer
samsung_galaxyj2_validity,end date of my samsung galaxy j2 plans
samsung_galaxyj2_validity,end time of my samsung galaxy j2 plans
samsung_galaxyj2_validity,expiry date of my samsung galaxy j2 account
samsung_galaxyj2_validity,expiry time of my samsung galaxy j2 plans
samsung_galaxyj2_validity,how can i do next recharge for samsung galaxy j2 offer
samsung_galaxyj2_validity,how long is the samsung galaxy j2 2018 jio cashback and additional data offer 2018 valid for
samsung_galaxyj2_validity,how many days for my plan to expire for samsung galaxy j2 offer
samsung_galaxyj2_validity,i just need to check my expiry date for samsung galaxy j2 offer
samsung_galaxyj2_withotheroffer,can i avail any other jio offer along with the samsung galaxy j2 2018 jio cashback and additional data offer 2018
samsung_galaxyj2_withotheroffer,can i have other jio offer along with galaxyj2 offer
samsung_galaxyj2_withotheroffer,i want to avail jio offer along with galaxy j2 offer
samsung_galaxyj2_withotheroffer,i want to have galaxy j2 offer along with other jio offer
search_jiocentre,can i search for nearest jio centre
search_jiocentre,convenient jio centre for me
search_jiocentre,find jio centre
search_jiocentre,find me the nearest jiocentres
search_jiocentre,get me close by jio centre
search_jiocentre,guide me jio centre
search_jiocentre,how do i find the nearest jiocentres
search_jiocentre,how do i search for jio centre
search_jiocentre,how i will come to know that where is nearest jio centre
search_jiocentre,jio centre in my area
search_jiocentre,jio centre store near by
search_jiocentre,locate jio centre
search_jiocentre,locate jio centre near my home
search_jiocentre,locate me jio centre nearby
search_jiocentre,locate me reliance digital centre
search_jiocentre,locate nearest jio centre
search_jiocentre,nearest jio centre
search_jiocentre,please show me jio centre which is near to my location
search_jiocentre,search jiocentre
search_jiocentre,search nearest jio centre
search_jiocentre,search nearest jio centre for me
search_jiocentre,show me jio centres
search_jiocentre,show me nearby jiocentres
search_jiocentre,tell me about my closest jio centre
search_jiocentre,where are your jio centres
search_jiocentre,where is the nearest jio centre
search_jiocentre,where is your jio centre
send_message,send a message
services_activate_call_forwarding,guide me to enable call forwarding service
services_activate_call_forwarding,how can i activate call forwarding service
services_activate_call_forwarding,how can i forward a call
services_activate_call_forwarding,how can i forward a call to another number
services_activate_call_forwarding,how to activate call forwarding
services_activate_call_forwarding,how to enable call forwarding
services_activate_call_forwarding,how to start call forwarding
services_activate_call_forwarding,how to turn on call forwarding
services_activate_call_forwarding,initiate call forwarding
services_activate_call_forwarding,procedure to activate call forwarding
services_activate_call_forwarding,set call forwarding
services_activate_call_forwarding,steps to enable call forwarding
services_activate_call-waiting,how can i activate the call waiting
services_activate_call-waiting,how to activate call waiting
services_activate_call-waiting,how to enable call waiting
services_activate_call-waiting,how to start call waiting
services_activate_call-waiting,how to turn on call waiting
services_activate_call-waiting,initiate call waiting
services_activate_call-waiting,is call waiting feature already activated
services_activate_call-waiting,number to activate call waiting
services_activate_call-waiting,procedure to activate call waiting
services_activate_call-waiting,provide me call waiting service
services_activate_call-waiting,steps to activate call waiting
services_activate_call-waiting,switch on call waiting
services_activate_call-waiting,trigger call waiting
services_activate_call-waiting,what is call waiting activation actions
services_activate_hold,begin call hold services
services_activate_hold,get me call hold service
services_activate_hold,give me call hold services
services_activate_hold,hey help me to activate hold service
services_activate_hold,how can i activate the call hold service
services_activate_hold,how to activate call hold services
services_activate_hold,how to start call hold services
services_activate_hold,how to turn on call hold services
services_activate_hold,initiate call hold services
services_activate_hold,procedure to activate call hold services
services_activate_hold,provide me call hold service
services_activate_hold,steps to activate call hold services
services_call_any_number_voice_conferencing,can i add landline in voice conferencing
services_call_any_number_voice_conferencing,can i call any number on voice conferencing
services_call_any_number_voice_conferencing,can i make conferencing while i am in roaming
services_call_any_number_voice_conferencing,which numbers i can add in conferencing
services_call_any_number_voice_conferencing,with whom i can do conferencing
services_call_browse_same_time,can i browse data along with call
services_call_browse_same_time,can i browse data and make call simultaneously
services_call_browse_same_time,can i browse data while calling
services_call_browse_same_time,can i browse internet along with call
services_call_browse_same_time,can i browse internet and make call simultaneously
services_call_browse_same_time,can i browse internet while calling
services_call_browse_same_time,can i browse net along with call
services_call_browse_same_time,can i browse net and make call simultaneously
services_call_browse_same_time,can i browse net while calling
services_call_browse_same_time,can i make a call and browse the web at the same time with my volte device
services_call_browse_same_time,can i make calls and use data pack together
services_call_browse_same_time,can i make calls and use internet together
services_call_browse_same_time,can i make calls and use net together
services_call_browse_same_time,is it possible to browse data and make calls together
services_call_browse_same_time,is it possible to browse net and make calls simultaneously
services_call_browse_same_time,is it possible to use data and make calls together
services_call_forwarding_about,brief call forwarding
services_call_forwarding_about,explain call forwarding
services_call_forwarding_about,my call is not forwarding to another number
services_call_forwarding_about,tell me something about call forwarding
services_call_forwarding_about,what is call forwarding about
services_call_forwarding_about,what is call forwarding service
services_call_forwarding_types,brief me the types of call forwarding
services_call_forwarding_types,explain the types of call forwarding
services_call_forwarding_types,tell me about the types of call forwarding
services_call_forwarding_types,what are different types of call forwarding
services_call_management_services,brief call management services
services_call_management_services,brief call services
services_call_management_services,list all call management services of jio
services_call_management_services,tell me call management services offered by jio
services_call_management_services,what are call management services
services_call_management_services,what are call management services are offered by jio
services_call_management_services,what are call services
services_call_management_services,what are call services of jio
services_call_management_services,what are call services offered by jio
services_call_management_services,what call management services are offered by jio
services_call_waiting-about,about call waiting
services_call_waiting-about,brief me about call waiting
services_call_waiting-about,how to know when someone is calling while am on another call
services_call_waiting-about,inform me about call waiting
services_call_waiting-about,may i know about call waiting
services_call_waiting-about,tell me about call waiting
services_call_waiting-about,use of call waiting service
services_call_waiting-about,uses of call waiting
services_call_waiting-about,what does call waiting means
services_call_waiting-about,what i will get in call waiting service
services_call_waiting-about,what is call waiting feature
services_call_waiting-about,what is call waiting for
services_call_waiting-about,what is the call waiting feature
services_calls_consume_data,do my video calls consume data from the data plan
services_calls_consume_data,do my voice calls consume data from the data plan
