label,expression
About_Jio,tell me about jio
About_Jio,tell me something about jio
About_Jio,want to know about jio
About_Jio,what do you know about jio
About_Jio,what is jio
About_Jio,what is jio about
About_Jio,what is the jio
About_Jio,what is this jio
access_premium_apps,access jio premium apps using jiofi
access_premium_apps,accessing jio premium apps via jiofi
access_premium_apps,can jio premium apps be accessed using jiofi
access_premium_apps,can jio premium apps be used on a device connected with jiofi
access_premium_apps,how can i access jio premium apps
access_premium_apps,how to install jio apps
access_premium_apps,method to use jio premium apps
access_premium_apps,process to access jio premium apps
access_premium_apps,steps to use jio premium apps
access_premium_apps,using jio premium apps
access_premium_apps,ways to use jio premium apps
account_health_checkup,account check
account_health_checkup,can you do a full check up on my account
account_health_checkup,can you do a full check up on myjio account
account_health_checkup,check my account
account_health_checkup,check my account fully
account_health_checkup,check my complete account
account_health_checkup,check my complete jio account
account_health_checkup,check my jio update
account_health_checkup,check myjio account
account_health_checkup,check myjio account fully
account_health_checkup,check myjio connection
account_health_checkup,check number
account_health_checkup,check whether my jio sim is working correctly or not
account_health_checkup,complete check up of my account
account_health_checkup,complete check up of myjio account
account_health_checkup,do a complete health check of my account
account_health_checkup,do a complete health check of my mobile account
account_health_checkup,do a complete health check of my mobile number
account_health_checkup,do a complete health check of my number
account_health_checkup,do a complete healthcheck of my account
account_health_checkup,do a complete healthcheck of my mobile account
account_health_checkup,do a complete healthcheck of my mobile number
account_health_checkup,do a complete healthcheck of my number
account_health_checkup,do full check up my account
account_health_checkup,do full check up myjio account
account_health_checkup,full check up of my account
account_health_checkup,full check up of myjio account
account_health_checkup,health status of my account
account_health_checkup,health status of my number
account_health_checkup,how is my account status
account_health_checkup,is my account healthy
account_health_checkup,is my account ok
account_health_checkup,is my jio number healthy
account_health_checkup,is my jio number ok
account_health_checkup,is my number healthy
account_health_checkup,is my number ok
account_health_checkup,is myjio account healthy
account_health_checkup,is myjio account ok
account_health_checkup,run health check for account
account_health_checkup,run health check of my account
account_health_checkup,run health check of my mobile account
account_health_checkup,run health check of my mobile number
account_health_checkup,run health check of my mobile number number
account_health_checkup,run health check of my number
account_health_checkup,run health check of my number number
account_health_checkup,run healthcheck of my account
account_health_checkup,run healthcheck of my mobile account
account_health_checkup,run healthcheck of my mobile number
account_health_checkup,run healthcheck of my mobile number number
account_health_checkup,run healthcheck of my number
account_health_checkup,run healthcheck of my number number
account_health_checkup,what is my account health status
account_health_checkup,what is my number health status
account_health_checkup,whats the health status of my account
account_health_checkup,whats the health status of my number
account_health_checkup,whats the health status of number
activate_upcoming_plan,can i activate any new plan when there is an existing plan
activate_upcoming_plan,i want to activate my upcoming plan
activate_upcoming_plan,if i recharge now what will happen to my current existing plan
activate_upcoming_plan,new upcoming plan of jio
activate_upcoming_plan,what will happen to my current existing plan if i activate another plan
activate_upcoming_plan,when my upcoming plan will be activated
ajio_all_product_ship_together,can you send all my ajio orders together
ajio_all_product_ship_together,can you ship all my ajio products together
ajio_all_product_ship_together,i want all my ajio product should come in one delivery
ajio_all_product_ship_together,i want all my ordered ajio products in on shipment
ajio_all_product_ship_together,i want all my ordered ajio products should come together
ajio_all_product_ship_together,will all ajio products come together
ajio_all_product_ship_together,will all the ajio products be shipped out together
ajio_amount_debited_while_placing_order,amount got debited while I was placing my order in ajio
ajio_amount_debited_while_placing_order,amount got deducted but ajio order shows as not confirmed
ajio_amount_debited_while_placing_order,money got debited but order is not confirmed in ajio
ajio_amount_debited_while_placing_order,money got debited while I was placing my order in ajio but no order was confirmed
ajio_amount_debited_while_placing_order,money got deducted but order shows as not confirmed in ajio
ajio_amount_debited_while_placing_order,what to do if money is deducted but still ajio order is not confirmed
ajio_apply_coupon,ajio coupon code not working
ajio_apply_coupon,ajio coupon does not get applied
ajio_apply_coupon,can you tell me that how can i use coupon
ajio_apply_coupon,how do i use my ajio coupon
ajio_apply_coupon,how to use ajio coupon
ajio_apply_coupon,i am not able to use my ajio coupon
ajio_apply_coupon,i am unable to apply ajio coupon
ajio_apply_coupon,i am unable to apply coupon in ajio
ajio_apply_coupon,way to use ajio coupon
ajio_cancel_order,can i cancel ajio order
ajio_cancel_order,can i cancel order of ajio
ajio_cancel_order,i am unable to cancel my order from ajio
ajio_cancel_order,i have ordered some products from ajio but now i want to cancel it
ajio_cancel_order,i want to cancel my order from ajio
ajio_cancel_order,not able to cancel my order from ajio
ajio_change_address_mobile_number,can i change my delivery address after placing an order on ajio
ajio_change_address_mobile_number,can I change my delivery address or mobile number on ajio
ajio_change_address_mobile_number,can i change my mobile number after placing an order on ajio
ajio_change_address_mobile_number,can i make changes in delivery address once the order is placed on ajio
ajio_change_address_mobile_number,can i make changes in mobile number once the order is placed on ajio
ajio_change_address_mobile_number,can i modify my delivery address after booking on ajio
ajio_change_address_mobile_number,can i modify my mobile number after booking on ajio
ajio_change_address_mobile_number,can i update my delivery address after booking on ajio
ajio_change_address_mobile_number,can i update my mobile number after booking on ajio
ajio_change_address_mobile_number,change delivery address post booking on ajio
ajio_change_address_mobile_number,change mobile number post booking on ajio
ajio_change_address_mobile_number,deliver package to a different address than to that at the time of booking on ajio
ajio_change_address_mobile_number,deliver package to a different mobile number than to that at the time of booking on ajio
ajio_change_address_mobile_number,I want to change my address after ordering on ajio
ajio_change_address_mobile_number,I want to change my mobile number after ordering on ajio
ajio_change_address_mobile_number,i want to change the address for my ajio order is it possible now
ajio_change_address_mobile_number,i want to change the mobile number for my ajio order is it possible now
ajio_change_address_mobile_number,is it possible to change address of delivery after booking on ajio
ajio_change_address_mobile_number,is it possible to change mobile number of delivery after booking on ajio
ajio_change_address_mobile_number,set delivery address after booking on ajio
ajio_change_address_mobile_number,set mobile number after booking on ajio
ajio_change_address_mobile_number,will i be allowed to change delivery address after order placement in ajio
ajio_change_address_mobile_number,will i be allowed to change mobile number after order placement in ajio
ajio_check_order_at_delivery,accept ajio parcel after cross verification
ajio_check_order_at_delivery,approval of ajio package only after verification
ajio_check_order_at_delivery,can i accept the ajio package after checking the contents inside
ajio_check_order_at_delivery,can i accept the ajio parcel after verifying
ajio_check_order_at_delivery,can i check the ajio package by opening it
ajio_check_order_at_delivery,can I check the ajio product before accepting delivery
ajio_check_order_at_delivery,can I check the product before accepting delivery from ajio
ajio_check_order_at_delivery,can i open ajio package before accepting it
ajio_check_order_at_delivery,can i open the order before accepting it from ajio
ajio_check_order_at_delivery,package verification of ajio
ajio_collect_parcel_by_other_people,can any other person collect my ajio parcel
ajio_collect_parcel_by_other_people,can i send my friend to collect my ajio parcel
ajio_collect_parcel_by_other_people,can my friend collect my parcel from ajio
ajio_collect_parcel_by_other_people,can other person collect ajio parcel on my behalf
ajio_collect_parcel_by_other_people,can someone collect the ajio parcel on my behalf
ajio_collect_parcel_by_other_people,is it possible to collect ajio parcel of other person
ajio_customercare,help me with customer care of ajio
ajio_customercare,how can i contact ajio customer care
ajio_customercare,how can i reach ajio customer care
ajio_customercare,how do i get in touch with ajio
ajio_customercare,how do i reach customer care of ajio
ajio_customercare,how do i reach to ajio customer care
ajio_customercare,how to connect with ajio customer care
ajio_customercare,how to contact ajio customer care
ajio_customercare,how to reach ajio
ajio_customercare,how to reach ajio customer care
ajio_customercare,how to reach you ajio
ajio_customercare,i want to talk to someone from ajio
ajio_customercare,tell me about ajio customer care
ajio_customercare,what is ajio customer care
ajio_customercare,what is the call center number of ajio
ajio_deliver_location,can i deliver outside india with ajio
ajio_deliver_location,can i delivery a package to other country from ajio
ajio_deliver_location,can i get delivery of a package outside india from ajio
ajio_deliver_location,can i make international delivery via ajio
ajio_deliver_location,do ajio deliver at my location
ajio_deliver_location,do ajio deliver everywhere in India
ajio_deliver_location,do ajio deliver internationally
ajio_deliver_location,do ajio provide international delivery
ajio_deliver_location,do ajio ship items abroad
ajio_deliver_location,do ajio ship items to united states
ajio_deliver_location,does ajio accept international orders
ajio_deliver_location,does ajio deliver internationally
ajio_deliver_location,does ajio support international delivery
ajio_deliver_location,international delivery offered by ajio
ajio_deliver_location,is it possible to make delivery to other nation from ajio
ajio_deliver_location,is my area serviceable for ajio
ajio_deliver_location,is there any scope of international delivery from ajio
ajio_download_invoice,can i get bill of my ajio order
ajio_download_invoice,can i get invoice of my ajio order
ajio_download_invoice,How do I find my ajio order invoice
ajio_download_invoice,How do I get my ajio order invoice
ajio_download_invoice,I need a bill for my ajio order
ajio_download_invoice,I need a invoice for my ajio order
ajio_download_invoice,i want bill of my ajio order
ajio_download_invoice,i want invoice of my ajio order
ajio_download_invoice,where i will get bill of my ajio order
ajio_download_invoice,where i will get invoice of my ajio order
ajio_download_invoice,Where is my ajio order invoice
ajio_genuine_products,are ajios products genuine
ajio_genuine_products,are the ajios products fake
ajio_genuine_products,do ajio really have genuine products
ajio_genuine_products,do ajio really have good products
ajio_genuine_products,do ajio really provide genuine products
ajio_genuine_products,do ajio really provide good products
ajio_genuine_products,is ajios products are really genuine or not
ajio_genuine_products,what is the guarantee of the products on ajio
ajio_gift_wrap,can i get my product with wrapping
ajio_gift_wrap,can i gift wrap a product for someone
ajio_gift_wrap,can you do gift wrapping of products
ajio_gift_wrap,i want to gift a product
ajio_gift_wrap,i want to gift this product please wrap it
ajio_gift_wrap,i want to gift wrap a product for someone
ajio_load_store_credits,can i add store credits to ajio account
ajio_load_store_credits,Can I load store credits into my ajio account
ajio_load_store_credits,How can I add store credits to my ajio account
ajio_load_store_credits,i want to add my store credits to my ajio account
ajio_load_store_credits,is it possible to add my store credits in my ajio account
ajio_load_store_credits,way to add store credits to ajio account
ajio_miss_delivery,i am not able to collect ajio delivery
ajio_miss_delivery,i am not at home and wont be able to take delivery of the ajio order
ajio_miss_delivery,i am not at home to take my ajio parcel what to do
ajio_miss_delivery,i wont be able to collect my delivery parcel of ajio
ajio_miss_delivery,what should I do if i miss my ajio delivery
ajio_my_store_credits,ajio store credits
ajio_my_store_credits,how much ajio store credit do i have
ajio_my_store_credits,how much ajio store credits do i have
ajio_my_store_credits,i want to know my ajio store credit
ajio_my_store_credits,show me my ajio store credit
ajio_my_store_credits,tell me my ajio store credits
ajio_my_store_credits,tell me status of my ajio store credits
ajio_my_store_credits,where can i find my ajio store credits
ajio_my_store_credits,where can i get my ajio store credits
ajio_order_delivery_time,approximate delivery time of ajio products
ajio_order_delivery_time,approximate time for order delivery of ajio
ajio_order_delivery_time,by what time can i expect delivery from ajio
ajio_order_delivery_time,estimated delivery time to my order from ajio
ajio_order_delivery_time,expected delivery time for my ajio product
ajio_order_delivery_time,how long will the ajio order delivery take
ajio_order_delivery_time,how much time will ajio will take to get my order delivered
ajio_order_delivery_time,order delivery time of ajio
ajio_order_delivery_time,time to get the order delivered from ajio
ajio_order_delivery_time,what is the estimated delivery time for ajio product
ajio_refund_credits_to_bank_account,can ajio refund my ajio store credits to my bank account
ajio_refund_credits_to_bank_account,can i get my ajio store credits refunded to my bank account
ajio_refund_credits_to_bank_account,i want all my ajio store credits to be refunded back in my bank
ajio_refund_credits_to_bank_account,i want my ajio store credits to be refunded to my bank account
ajio_refund_credits_to_bank_account,is it possible to get all ajio store credits refunded to my bank account
ajio_refund_credits_to_bank_account,process to get ajio store credits refunded back to bank account
ajio_refund_for_different_mode_of_payment,By what means i will get my money back from ajio
ajio_refund_for_different_mode_of_payment,By what means i will get my refund from ajio
ajio_refund_for_different_mode_of_payment,By what modes i will get my money back from ajio
ajio_refund_for_different_mode_of_payment,by what modes i will get my money back on ajio
ajio_refund_for_different_mode_of_payment,By what modes i will get my refund from ajio
ajio_refund_for_different_mode_of_payment,by what modes i will get my refund on ajio
ajio_refund_for_different_mode_of_payment,how much amount will get refunded to me from ajio
ajio_refund_for_different_mode_of_payment,How will i get my money back from ajio
ajio_refund_for_different_mode_of_payment,how will i get my money back on ajio
ajio_refund_for_different_mode_of_payment,How will i get my money back on order cancellation from ajio
ajio_refund_for_different_mode_of_payment,how will i get my money back on order cancellation on ajio
ajio_refund_for_different_mode_of_payment,How will i get my payment back from ajio
ajio_refund_for_different_mode_of_payment,how will i get my payment back on ajio
ajio_refund_for_different_mode_of_payment,How will i get refund from ajio
ajio_refund_for_different_mode_of_payment,how will i get refund on ajio
ajio_refund_for_different_mode_of_payment,How will i receive refund amount from ajio
ajio_refund_for_different_mode_of_payment,how will i receive refund amount on ajio
ajio_refund_for_different_mode_of_payment,i paid for an ajio order using JioMoney if i return a product where will i get my refund
ajio_refund_for_different_mode_of_payment,i paid on ajio with paytm how i will get refund
ajio_refund_for_different_mode_of_payment,Mode of my refund from ajio
ajio_refund_for_different_mode_of_payment,mode of my refund on ajio
ajio_refund_for_different_mode_of_payment,what amount will get refunded to me from ajio
ajio_refund_for_different_mode_of_payment,What will be the mode of getting my money back from ajio
ajio_refund_for_different_mode_of_payment,what will be the mode of getting my money back on ajio
ajio_refund_for_different_mode_of_payment,What will be the mode of getting my payment back from ajio
ajio_refund_for_different_mode_of_payment,What will be the mode of my refund from ajio
ajio_refund_for_different_mode_of_payment,what will be the mode of my refund on ajio
ajio_refund_for_different_mode_of_payment,will I receive whole amount as refund from ajio
ajio_refund_time,How long will it take to get my amount back from ajio
ajio_refund_time,How long will it take to get my money back from ajio
ajio_refund_time,How long will it take to get my payment back from ajio
ajio_refund_time,How long will it take to receive the refund for my returned item of ajio
ajio_refund_time,How long will it take to receive the refund from ajio
ajio_refund_time,How much time will it take to get my amount back from ajio
ajio_refund_time,How much time will it take to get my money back from ajio
ajio_refund_time,How much time will it take to get my payment back from ajio
ajio_refund_time,How much time will it take to receive the refund for my returned item from ajio
ajio_refund_time,How much time will it take to receive the refund from ajio
ajio_refund_time,In how many days will i get my amount back from ajio
ajio_refund_time,In how many days will i get my money back from ajio
ajio_refund_time,In how many days will i get my payment back from ajio
ajio_refund_time,In how many days will i receive the refund from ajio
ajio_refund_time,when will I receive my refund from ajio
ajio_return_desk_address,address of ajios return desk
ajio_return_desk_address,ajios returns desk address
ajio_return_desk_address,place of ajios return desk
ajio_return_desk_address,place to return ajios products
ajio_return_desk_address,return desk of ajio
ajio_return_desk_address,what is your returns desk address
ajio_return_desk_address,where can i return ajios items
ajio_return_desk_address,where do i return the item
ajio_return_desk_address,where i have to return products of ajio
ajio_return_exchange_product,am not satisfied with ajio product how to exchange it
ajio_return_exchange_product,am not satisfied with ajio product how to return it
ajio_return_exchange_product,can I exchange my ajio order
ajio_return_exchange_product,can I exchange my ajio product
ajio_return_exchange_product,can I return my ajio order
ajio_return_exchange_product,can I return my ajio product
ajio_return_exchange_product,how can I exchange my ajio order
ajio_return_exchange_product,how can I exchange my ajio package
ajio_return_exchange_product,how can I exchange my ajio product
ajio_return_exchange_product,how can I return my ajio order
ajio_return_exchange_product,how can I return my ajio package
ajio_return_exchange_product,how can I return my ajio product
ajio_return_exchange_product,how to exchange my ajio order
ajio_return_exchange_product,how to exchange my ajio package
ajio_return_exchange_product,how to give back my ajio order
ajio_return_exchange_product,how to give back my ajio package
ajio_return_exchange_product,I received damaged ajio product how do i exchange it
ajio_return_exchange_product,I received damaged ajio product how do i return it
ajio_return_exchange_product,I received wrong ajio order how do i exchange it
ajio_return_exchange_product,I received wrong ajio order how do i return it
ajio_return_exchange_product,I want to exchange my ajio order
ajio_return_exchange_product,I want to exchange my ajio package
ajio_return_exchange_product,I want to exchange my ajio product
ajio_return_exchange_product,I want to return my ajio order
ajio_return_exchange_product,I want to return my ajio package
ajio_return_exchange_product,I want to return my ajio product
ajio_return_exchange_product,procedure to exchange my ajio order
ajio_return_exchange_product,procedure to exchange my ajio product
ajio_return_exchange_product,procedure to return my ajio order
ajio_return_exchange_product,procedure to return my ajio product
ajio_return_exchange_product,way to exchange ajio order
ajio_return_exchange_product,way to exchange ajio product
ajio_return_exchange_product,way to return ajio order
ajio_return_exchange_product,way to return ajio product
ajio_shipping_charges,ajio shipping charges
ajio_shipping_charges,any shipping charges applied on ordered amount from ajio
ajio_shipping_charges,are any shipping charges applied on ordered items of ajio
ajio_shipping_charges,are any shipping charges applied on ordered products of ajio
ajio_shipping_charges,are shipping charges applied on the orders placed in ajio
ajio_shipping_charges,can there be any hidden costs of shipping charges from ajio
ajio_shipping_charges,How much will the shipping cost of ajio
ajio_shipping_charges,What are the delivery charges of ajio
ajio_shipping_charges,What are the delivery fees of ajio
ajio_shipping_charges,What are the shipping fees of ajio
ajio_track_my_order,how can I check whether my ajio order is shipped or not
ajio_track_my_order,how can I receive updates of my ajio order
ajio_track_my_order,how can I track my ajio order
ajio_track_my_order,track my ajio order
ajio_track_my_order,what is the status of my ajio order
ajio_track_my_order,what is the status of my ajio product
ajio_track_my_order,when will my ajio order get delivered
ajio_track_my_order,where is my ajio order
all_jio_apps_start_use,automatic login jio music
all_jio_apps_start_use,can i use myjio account information for jiocloud
all_jio_apps_start_use,can i use myjio account information for jiotv
all_jio_apps_start_use,can i use myjio login to get into jiocloud
all_jio_apps_start_use,can i use myjio login to get into jiotv
all_jio_apps_start_use,can i use the same sign in information as in myjio in jiocloud
all_jio_apps_start_use,can i use the same sign in information as in myjio in jiotv
all_jio_apps_start_use,credentials of my jiocloud account
all_jio_apps_start_use,do i use the same sign in information as myjio in jiocloud
all_jio_apps_start_use,do i use the same sign in information as myjio in jiotv
all_jio_apps_start_use,guidelines for using jiocloud
all_jio_apps_start_use,help me in signing up in jiocloud
all_jio_apps_start_use,help me in signing up in jiotv
all_jio_apps_start_use,help me in using jiotv
all_jio_apps_start_use,how can i access my jiotv
all_jio_apps_start_use,how can i start using jiomusic
all_jio_apps_start_use,how can i use jio app
all_jio_apps_start_use,how can i use the jio app please show me the video
all_jio_apps_start_use,how do i sign up for jiotv
all_jio_apps_start_use,how do i start using jiocloud
all_jio_apps_start_use,how do i start using jiotv
all_jio_apps_start_use,how to begin jiocloud
all_jio_apps_start_use,how to begin jiotv
all_jio_apps_start_use,how to log in in jiomusic
all_jio_apps_start_use,how to register account on jiotv
all_jio_apps_start_use,how to run jiocloud
all_jio_apps_start_use,how to run jiotv
all_jio_apps_start_use,how to sign in jio tv
all_jio_apps_start_use,how to sign in jiotv
all_jio_apps_start_use,how to sign up for jiotv
all_jio_apps_start_use,how to sign up jiocloud
all_jio_apps_start_use,how to sign up jiotv
all_jio_apps_start_use,how to sign-up in jiomusic
all_jio_apps_start_use,how to start jiocloud
all_jio_apps_start_use,how to start jiotv
all_jio_apps_start_use,how to subscribe my jiotv
all_jio_apps_start_use,how to use jiocloud
all_jio_apps_start_use,how to use jiotv
all_jio_apps_start_use,how to use this app
all_jio_apps_start_use,i cannot login my jiomoney
all_jio_apps_start_use,i say that my jiotv is not started he ask username and password
all_jio_apps_start_use,i want to know about the sign in information in jiocloud
all_jio_apps_start_use,i want to know about the sign in information in jiotv
all_jio_apps_start_use,i want to log in to jiomusic but i can not do so
all_jio_apps_start_use,information about sign in in jiocloud
all_jio_apps_start_use,information about sign in in jiotv
